INPUT:text_first,INPUT:text_second,OUTPUT:result,CONFIDENCE:result,vote_type,vote_different,vote_some_details_lost,vote_OK,average,NE,POS,sentence_type_lost
Your booking is successful. The total bill is $432 and you can contact them at +1 470-231-3030.,u can book your place and it works.$432 total bill u can call them at 470-231-3030,some_details_lost,0.9999,13,1,3,0,1.75,corrupted,,
"Please confirm your appointment with A A Aesthetics Dental Care at March 5th, 1 pm.","CHECK OUT A A EASY DENTCARE AT MARY 5TH, 1PM.",different,0.9999,13,3,1,0,1.25,lost,,imperative
"Great, scheduling a visit to Bel Air on March 14th",It is great that Bel Air will be hosting a visit on March 14th.,different,0.9555,12,2,0,1,1.666666667,ok,verb,
Want to visit her?,I would like to visit her.,different,0.9999,12,2,0,1,1.666666667,ok,,interrogative
Departure date and place? Return date?,What is the difference between a separate date and a location? Do you want to return the date?,different,0.9999,12,2,1,0,1.333333333,ok,,
At 6 Pm on March 9th there's a Sparks Vs Mystics playing a the STAPLES Center.,"At 6 PM on March 9th, there is a Sparks Vs. Mystics playing at the Sports Center.",some_details_lost,0.9534,13,0,3,1,2.25,corrupted,,
I want to visit next Tuesday,i wanna go to next wed.,different,0.9999,13,3,1,0,1.25,corrupted,,
In Philadelphia the event is called Blueface.,blueface in philippines,different,1,6,6,0,0,1,lost,,
Confirm Find Me on Kitchen speaker.,go to kitchen speaker and say find me.,some_details_lost,0.9899,12,1,2,0,1.666666667,ok,verb,
What do I have going on for Monday next week?,What do I have planned for next week?,OK,0.9863,3,0,0,3,3,ok,,
Where do you want to depart from?,where do u wanna go?,different,0.9999,12,2,0,1,1.666666667,ok,prep,
yea red jennifer sounds awesome!,"Yes, Red Joan sounds great!",different,0.9999,13,3,1,0,1.25,corrupted,,
Do you llke Hotel Mumbai?,Do you want to go to the hotel Mumbai?,some_details_lost,0.9993,12,1,2,0,1.666666667,ok,verb,
when are you traveling,You are traveling when you are traveling.,different,1,6,6,0,0,1,ok,verb,
I plan on leaving next Thursday,i'm going to leave next friday,different,0.9968,13,3,1,0,1.25,corrupted,,
"Yes, they serve alcohol!",yea they drink!,different,0.9999,13,3,1,0,1.25,ok,verb,
I need to leave at morning 7 on the 2nd. I'm going to Philadelphia.,"I need to leave at dawn on the 2nd. I am going to Philadelphia, where I will be attending.",some_details_lost,0.9999,3,0,3,0,2,lost,,
Shall I book it?,Should I book the book?,different,1,3,3,0,0,1,ok,verb,
"I'm going from Las Vegas to Seattle, leaving on the 14th of March",I am going from Las Vegas to Seattle on the fourteenth of March.,OK,0.9974,3,0,0,3,3,ok,,
Child-friendly?,CHILDREN-FEELING?,different,1,6,6,0,0,1,ok,adj,
9:12 and 4:57,The flight will arrive at 9:12 pm and return at 4:57 am.,different,0.9968,3,3,0,0,1,corrupted,,
Destination? Departure city?,Divination? Get rid of this city,different,1,3,3,0,0,1,corrupted,verb,
"please confirm, reserving 1 room at Hampton Inn Las Vegas/Summerlin in Las Vegas with a check in on march 9th and check out on March 14th.",check in on march 9& mart 14:),different,0.9844,13,3,1,0,1.25,lost,,
Ninety-nine dollars.,$93.,different,1,3,3,0,0,1,corrupted,,
until what date and when?,What date and when do you want to go on a date?,different,0.988,13,3,1,0,1.25,ok,prep,